{
  "schema_version": "v5.source-candidate.1",
  "source_url": "https://github.com/SWE-bench/SWE-bench/pull/504",
  "repo": "swe-bench/swe-bench",
  "source_type": "github_pr",
  "github_number": 504,
  "title": "docs: document results caching",
  "body": "<!--\r\nThanks for contributing a pull request!\r\n-->\r\n\r\n#### Reference Issues/PRs\r\n<!--\r\nExample: \"Fixes #1234\", \"See also #3456\"\r\nPlease use keywords (e.g., Fixes) to create link to the issues or pull requests\r\nyou resolved, so that they will automatically be closed when your pull request\r\nis merged. See https://github.com/blog/1506-closing-issues-via-pull-requests\r\n-->\r\n\r\nN/A\r\n\r\n#### What does this implement/fix? Explain your changes.\r\n<!--\r\nPlease include a brief explanation of how your solution\r\nfixes the tagged issue(s), along with what files / entities have\r\nbeen modified for this fix.\r\n-->\r\n\r\nImproves documentation about results caching.\r\n\r\n#### Any other comments?\r\n\r\nN/A\r\n<!-- 🧡 Thanks for contributing! -->\r\n",
  "comments": [],
  "linked_pr_diff": "diff --git a/README.md b/README.md\nindex 16563c309..079ddc987 100644\n--- a/README.md\n+++ b/README.md\n@@ -92,6 +92,9 @@ This command will generate docker build logs (`logs/build_images`) and evaluatio\n \n The final evaluation results will be stored in the `evaluation_results` directory.\n \n+> [!NOTE]\n+> **Result Caching**: The evaluation harness caches results by `run_id` and `instance_id` only. If you run the same instance with the same `run_id` multiple times, even with different prediction diffs, the harness will reuse the cached results from the first run and will not re-evaluate. To re-evaluate an instance with a different prediction diff, you must use a different `run_id`.\n+\n > [!WARNING]\n > SWE-bench evaluation can be resource intensive\n > We recommend running on an `x86_64` machine with at least 120GB of free storage, 16GB of RAM, and 8 CPU cores.\ndiff --git a/docs/faq.md b/docs/faq.md\nindex 622985680..fc6f7613f 100644\n--- a/docs/faq.md\n+++ b/docs/faq.md\n@@ -98,6 +98,23 @@ No. Docker is required for consistent evaluation environments. This ensures that\n \n Your model should produce a diff or patch that can be applied to the original code. The exact format depends on the instance, but we typically recommend the diff generated by `git diff`.\n \n+### Why isn't my evaluation re-running when I change the prediction diff?\n+\n+The evaluation harness caches results by `run_id` and `instance_id` only. It does not consider the prediction diff content when checking the cache. This means that if you run the same instance with the same `run_id` multiple times, even with different prediction diffs, the harness will reuse the cached results from the first run and will not re-evaluate.\n+\n+To re-evaluate an instance with a different prediction diff, you must use a different `run_id`. For example:\n+```bash\n+# First evaluation\n+python -m swebench.harness.run_evaluation \\\n+    --predictions_path predictions_v1.jsonl \\\n+    --run_id my_run_v1\n+\n+# Re-evaluation with different predictions (must use different run_id)\n+python -m swebench.harness.run_evaluation \\\n+    --predictions_path predictions_v2.jsonl \\\n+    --run_id my_run_v2\n+```\n+\n ## Troubleshooting\n \n ### My evaluation is stuck or taking too long\ndiff --git a/docs/guides/evaluation.md b/docs/guides/evaluation.md\nindex a9c8a44f3..8fcd0d8b2 100644\n--- a/docs/guides/evaluation.md\n+++ b/docs/guides/evaluation.md\n@@ -118,6 +118,12 @@ python -m swebench.harness.run_evaluation \\\n     --max_workers 8\n ```\n \n+### Result Caching\n+\n+The evaluation harness caches results by `run_id` and `instance_id`. This means that if you run the same instance with the same `run_id` multiple times, even with different prediction diffs, the harness will reuse the cached results from the first run and will not re-evaluate the instance. \n+\n+**Important**: If you want to re-evaluate an instance with a different prediction diff, you must use a different `run_id` to ensure the new prediction is evaluated.\n+\n ### Cleaning Up Resources\n \n To automatically clean up resources after evaluation, use the `--clean` parameter:\ndiff --git a/docs/reference/harness.md b/docs/reference/harness.md\nindex a1e450f91..ab8765b8d 100644\n--- a/docs/reference/harness.md\n+++ b/docs/reference/harness.md\n@@ -125,6 +125,16 @@ The `--cache_level` parameter controls how Docker images are cached between runs\n \n Most users should use the default `env` level, which provides a good balance between speed and storage usage.\n \n+## Result Caching\n+\n+The evaluation harness caches evaluation results by `run_id` and `instance_id`. This means:\n+\n+- If you run the same instance with the same `run_id` multiple times, the harness will reuse the cached results from the first run\n+- **The cache does not consider the prediction diff content** - even if you provide a different prediction diff for the same `run_id` and `instance_id`, the harness will return the cached results without re-evaluating\n+- To re-evaluate an instance with a different prediction diff, you must use a different `run_id`\n+\n+This caching behavior is designed to speed up repeated evaluations, but it's important to be aware that changing the prediction diff alone will not trigger a re-evaluation.\n+\n ## Dataset Options\n \n The harness supports evaluation on various SWE-bench datasets:\n",
  "github_state": "open",
  "github_created_at": "2025-12-11T15:25:22Z",
  "github_updated_at": "2026-08-07T23:26:16Z",
  "candidate_benchmark_names": [
    "swebench-verified",
    "swebench_multilingual"
  ],
  "terminal_status": "rejected",
  "audit_level": "L1",
  "decision_note": "Documentation for results caching only; no benchmark task, dataset, evaluator, or scoring defect claim.",
  "reviewed_at": "2026-08-08T00:09:03.911Z",
  "checked_urls": [
    "https://github.com/SWE-bench/SWE-bench/pull/504"
  ]
}
