{
  "schema_version": "v5.source-candidate.1",
  "source_url": "https://github.com/openai/frontier-evals/pull/182",
  "repo": "openai/frontier-evals",
  "source_type": "github_pr",
  "github_number": 182,
  "title": "chore: update evmbench image",
  "body": "No PR body.",
  "comments": [],
  "linked_pr_diff": "diff --git a/project/evmbench/evmbench/Dockerfile b/project/evmbench/evmbench/Dockerfile\nindex 32e44c1d..abf3e848 100644\n--- a/project/evmbench/evmbench/Dockerfile\n+++ b/project/evmbench/evmbench/Dockerfile\n@@ -56,7 +56,7 @@ RUN set -eux; \\\n     cd /; rm -rf /usr/local/src/codex; \\\n     codex --version\n \n-ENV CLAUDE_CODE_VERSION=2.1.32\n+ENV CLAUDE_CODE_VERSION=2.1.80\n RUN npm install -g @anthropic-ai/claude-code@${CLAUDE_CODE_VERSION}\n \n ENV GEMINI_VERSION=0.25.0\n",
  "github_state": "closed",
  "github_created_at": "2026-10-10T06:47:21Z",
  "github_updated_at": "2026-10-12T17:49:12Z",
  "candidate_benchmark_names": [
    "swe-lancer-diamond"
  ],
  "terminal_status": "out_of_scope",
  "audit_level": "L2",
  "decision_note": "L2 PR metadata/diff audit. Although openai/frontier-evals maps to swe-lancer-diamond, merged PR #182 only bumps CLAUDE_CODE_VERSION in project/evmbench/evmbench/Dockerfile. The thread and diff provide EVMBench image-maintenance evidence, not SWE-Lancer Diamond or shared Frontier Evals harness defect evidence, so it is outside the current benchmark scope.",
  "checked_urls": [
    "https://github.com/openai/frontier-evals/pull/182",
    "https://github.com/openai/frontier-evals/pull/182/files"
  ],
  "reviewed_at": "2026-10-13T00:06:41.670Z"
}
