{
  "schema_version": "v5.source-candidate.1",
  "source_url": "https://github.com/ShishirPatil/gorilla/pull/1242",
  "repo": "shishirpatil/gorilla",
  "source_type": "github_pr",
  "github_number": 1242,
  "title": "[BFCL] Add support for `kimi-k2-0905-preview`",
  "body": "Bump Kimi-K2 version from `kimi-k2-0711-preview` to `kimi-k2-0905-preview` ",
  "comments": [],
  "linked_pr_diff": "diff --git a/berkeley-function-call-leaderboard/SUPPORTED_MODELS.md b/berkeley-function-call-leaderboard/SUPPORTED_MODELS.md\nindex 5f98f786ecce..a1a2e5ba14cb 100644\n--- a/berkeley-function-call-leaderboard/SUPPORTED_MODELS.md\n+++ b/berkeley-function-call-leaderboard/SUPPORTED_MODELS.md\n@@ -75,8 +75,8 @@ For model names containing `{...}`, multiple versions are available. For example\n | Grok-4-0709                                | Prompt           | xAI            | grok-4-0709                                                 |\n | Haha-7B                                    | Prompt           | Self-hosted 💻 | ZJared/Haha-7B                                              |\n | Hammer2.1-{7b,3b,1.5b,0.5b}                | Function Calling | Self-hosted 💻 | MadeAgents/Hammer2.1-{7b,3b,1.5b,0.5b}                      |\n-| Kimi-K2-Instruct                           | Function Calling | MoonshotAI     | kimi-k2-0711-preview-FC                                     |\n-| Kimi-K2-Instruct                           | Prompt           | MoonshotAI     | kimi-k2-0711-preview                                        |\n+| Kimi-K2-Instruct                           | Function Calling | MoonshotAI     | kimi-k2-0905-preview-FC                                     |\n+| Kimi-K2-Instruct                           | Prompt           | MoonshotAI     | kimi-k2-0905-preview                                        |\n | Ling-lite-v1.5                             | Prompt           | Ant Group      | Ling/ling-lite-v1.5                                         |\n | Llama-3.1-{8B,70B}-Instruct                | Function Calling | Self-hosted 💻 | meta-llama/Llama-3.1-{8B,70B}-Instruct-FC                   |\n | Llama-3.1-{8B,70B}-Instruct                | Prompt           | Self-hosted 💻 | meta-llama/Llama-3.1-{8B,70B}-Instruct                      |\ndiff --git a/berkeley-function-call-leaderboard/bfcl_eval/constants/model_config.py b/berkeley-function-call-leaderboard/bfcl_eval/constants/model_config.py\nindex 654d71c676b6..35cced5b6f5b 100644\n--- a/berkeley-function-call-leaderboard/bfcl_eval/constants/model_config.py\n+++ b/berkeley-function-call-leaderboard/bfcl_eval/constants/model_config.py\n@@ -1096,8 +1096,8 @@ class ModelConfig:\n         is_fc_model=True,\n         underscore_to_dot=True,\n     ),\n-    \"kimi-k2-0711-preview-FC\": ModelConfig(\n-        model_name=\"moonshotai/Kimi-K2-Instruct\",\n+    \"kimi-k2-0905-preview-FC\": ModelConfig(\n+        model_name=\"kimi-k2-0905-preview\",\n         display_name=\"Moonshotai-Kimi-K2-Instruct (FC)\",\n         url=\"https://huggingface.co/moonshotai/Kimi-K2-Instruct\",\n         org=\"MoonshotAI\",\n@@ -1108,8 +1108,8 @@ class ModelConfig:\n         is_fc_model=True,\n         underscore_to_dot=True,\n     ),\n-    \"kimi-k2-0711-preview\": ModelConfig(\n-        model_name=\"moonshotai/Kimi-K2-Instruct\",\n+    \"kimi-k2-0905-preview\": ModelConfig(\n+        model_name=\"kimi-k2-0905-preview\",\n         display_name=\"Moonshotai-Kimi-K2-Instruct (Prompt)\",\n         url=\"https://huggingface.co/moonshotai/Kimi-K2-Instruct\",\n         org=\"MoonshotAI\",\ndiff --git a/berkeley-function-call-leaderboard/bfcl_eval/constants/supported_models.py b/berkeley-function-call-leaderboard/bfcl_eval/constants/supported_models.py\nindex 7d8b2c5baa6a..d29bdfcafba4 100644\n--- a/berkeley-function-call-leaderboard/bfcl_eval/constants/supported_models.py\n+++ b/berkeley-function-call-leaderboard/bfcl_eval/constants/supported_models.py\n@@ -94,8 +94,8 @@\n     \"Ling/ling-lite-v1.5\",\n     \"glm-4.5-FC\",\n     \"glm-4.5-air-FC\",\n-    \"kimi-k2-0711-preview-FC\",\n-    \"kimi-k2-0711-preview\",\n+    \"kimi-k2-0905-preview-FC\",\n+    \"kimi-k2-0905-preview\",\n     \"deepseek-ai/DeepSeek-R1\",\n     \"google/gemma-3-1b-it\",\n     \"google/gemma-3-4b-it\",\ndiff --git a/berkeley-function-call-leaderboard/bfcl_eval/model_handler/api_inference/kimi.py b/berkeley-function-call-leaderboard/bfcl_eval/model_handler/api_inference/kimi.py\nindex b0bde9fef6fb..36c7a4ed9eac 100644\n--- a/berkeley-function-call-leaderboard/bfcl_eval/model_handler/api_inference/kimi.py\n+++ b/berkeley-function-call-leaderboard/bfcl_eval/model_handler/api_inference/kimi.py\n@@ -15,9 +15,9 @@ def __init__(\n         super().__init__(model_name, temperature, registry_name, is_fc_model, **kwargs)\n \n         self.client = OpenAI(\n-            # base_url=\"https://api.moonshot.ai/v1\", \n+            base_url=\"https://api.moonshot.ai/v1\", \n             # If API Key is from US platform, use the above URL\n             # If API Key is from China platform, use the below URL\n-            base_url=\"https://api.moonshot.cn/v1\", \n+            # base_url=\"https://api.moonshot.cn/v1\", \n             api_key=os.getenv(\"KIMI_API_KEY\")\n         )\n",
  "github_state": "closed",
  "github_created_at": "2025-11-03T02:20:05Z",
  "github_updated_at": "2026-08-13T09:48:37Z",
  "candidate_benchmark_names": [
    "bfcl"
  ],
  "terminal_status": "rejected",
  "audit_level": "L1",
  "checked_urls": [
    "https://github.com/ShishirPatil/gorilla/pull/1242"
  ],
  "decision_note": "L1 audit: merged PR only bumps/adds Kimi model support. It is model coverage/handler support work, not a benchmark defect claim.",
  "reviewed_at": "2026-08-14T00:06:09.015Z"
}
