{
  "schema_version": "v5.source-candidate.1",
  "source_url": "https://github.com/cooperbench/CooperBench/issues/81",
  "repo": "cooperbench/cooperbench",
  "source_type": "github_issue",
  "github_number": 81,
  "title": "Can I submit local scores to Leaderboard?",
  "body": "### Description\n\nCan I submit local scores to Leaderboard?\n\n### Steps to Reproduce\n\nCan I submit local scores to Leaderboard?\n\n### Environment\n\n_No response_\n\n### Additional Information\n\n_No response_",
  "comments": [
    {
      "url": "https://github.com/cooperbench/CooperBench/issues/81#issuecomment-5271790821",
      "user": "ProKil",
      "created_at": "2026-08-12T19:26:47Z",
      "updated_at": "2026-08-12T19:26:47Z",
      "body": "Yeah, happy to include submissions! @freehome1 would you mind providing a brief description of the method and results? Feel free to email zhuhao@stanford.edu"
    }
  ],
  "linked_pr_diff": null,
  "github_state": "open",
  "github_created_at": "2026-08-10T07:24:18Z",
  "github_updated_at": "2026-08-12T19:26:47Z",
  "candidate_benchmark_names": [
    "cooperbench"
  ],
  "terminal_status": "rejected",
  "audit_level": "L1",
  "decision_note": "Thread asks whether local scores can be submitted to the leaderboard; no benchmark defect is claimed.",
  "reviewed_at": "2026-08-13T00:06:47.704Z",
  "checked_urls": [
    "https://github.com/cooperbench/CooperBench/issues/81"
  ]
}
