{
  "schema_version": "v5.source-candidate.1",
  "source_url": "https://github.com/datacurve-ai/deep-swe/issues/27",
  "repo": "datacurve-ai/deep-swe",
  "source_type": "github_issue",
  "github_number": 27,
  "title": "Add more languages in tests to get a broader picture of models' capabilities",
  "body": "Hi,\n\nthank you for your work creating a better benchmark to get a real picture of AI models' capabilities.\nAs a .NET developer, I'd like to see which model could help me in my job. Unfortunately, there haven't been any tests for C#.\nCould you plan to expand the supported languages in tests? Or do you have documentation on how to help with this?",
  "comments": [],
  "linked_pr_diff": null,
  "github_state": "open",
  "github_created_at": "2026-06-04T14:00:24Z",
  "github_updated_at": "2026-06-04T14:00:24Z",
  "candidate_benchmark_names": [
    "deep-swe"
  ],
  "reviewed_at": "2026-06-17T12:00:00.000Z",
  "checked_urls": [
    "https://github.com/datacurve-ai/deep-swe/issues/27"
  ],
  "terminal_status": "out_of_scope",
  "audit_level": "L1",
  "decision_note": "Not a benchmark task/grading defect (model-add request, dependency bump, task-addition/enhancement PR, license/doc/question, or unrelated tooling). Triaged out of scope."
}
