{
  "schema_version": "v5.source-candidate.1",
  "source_url": "https://github.com/xlang-ai/Spider2/issues/204",
  "repo": "xlang-ai/spider2",
  "source_type": "github_issue",
  "github_number": 204,
  "title": "Request for Snowflake access",
  "body": "I have filled in this form and submitted twice: https://docs.google.com/forms/d/e/1FAIpQLScbVIYcBkADVr-NcYm9fLMhlxR7zBAzg-jaew1VNRj6B8yD3Q/viewform?usp=sf_link\n\nMy Email: 876782145@qq.com, peterliuwt00376@gmail.com\n\nCould you help to create account?\n\nMany thanks!",
  "comments": [
    {
      "url": "https://github.com/xlang-ai/Spider2/issues/204#issuecomment-5187620750",
      "user": "knitemblazor",
      "created_at": "2026-08-05T04:40:47Z",
      "updated_at": "2026-08-05T04:40:47Z",
      "body": "I too have filled the Google form can you grant access\nEmail niteshmichael@gmail.com"
    }
  ],
  "linked_pr_diff": null,
  "github_state": "open",
  "github_created_at": "2026-07-23T22:58:01Z",
  "github_updated_at": "2026-08-05T04:40:47Z",
  "candidate_benchmark_names": [
    "spider2-dbt"
  ],
  "terminal_status": "out_of_scope",
  "audit_level": "L1",
  "decision_note": "L1 thread audit. The issue and comment request Snowflake account access after submitting the Spider2 Snowflake access form. It does not mention Spider2-DBT task rows, DBT evaluator logic, or DBT dataset artifacts. Snowflake access/provisioning belongs to the Spider2-Snow/Snowflake variant, outside the current spider2-dbt benchmark scope.",
  "reviewed_at": "2026-08-06T00:05:06Z",
  "checked_urls": [
    "https://github.com/xlang-ai/Spider2/issues/204"
  ]
}
