{
  "schema_version": "v5.source-candidate.1",
  "source_url": "https://github.com/SWE-bench/SWE-bench/pull/642",
  "repo": "swe-bench/swe-bench",
  "source_type": "github_pr",
  "github_number": 642,
  "title": "Add swebench publish: upload run results to an HF bucket + eval-results yaml",
  "body": "## Summary\n- Adds `swebench publish RUN_ID`, which uploads a run's report (and optionally its predictions) to a Hugging Face bucket and writes a `.eval_results/*.yaml` entry scored against it.\n- The yaml format matches the Hub's community eval-results system: https://huggingface.co/docs/hub/eval-results\n- New module `swebench/harness/publish_results.py`: `upload_run()` (create/upload to a bucket, `dry_run` supported) and `write_eval_result()` (writes one eval-results entry).\n- Adds `huggingface_hub>=1.20` as a dependency (needed for bucket support).\n\n## Test plan\n- [x] `pytest tests/test_publish_results.py` passes\n- [x] `swebench publish --help` and a `--dry-run` invocation work end-to-end against a fabricated report file\n- [x] `ruff format`/`ruff check` clean relative to the existing codebase conventions\n\n🤖 Generated with [Claude Code](https://claude.com/claude-code)",
  "comments": [],
  "linked_pr_diff": "diff --git a/README.md b/README.md\nindex 22b3af727..1be9514e2 100644\n--- a/README.md\n+++ b/README.md\n@@ -93,6 +93,7 @@ Other commands:\n swebench images build verified -j 8           # build/pull images ahead of time\n swebench images check multilingual            # verify images exist on the registry\n swebench images clean --run-id <run_id>       # remove leftover containers\n+swebench publish <run_id> -b <user/bucket> --report <report.json> -d verified --task-id swe_bench_%_resolved   # upload results to an HF bucket\n swebench --help                               # all commands\n ```\n \ndiff --git a/docs/reference/cli.md b/docs/reference/cli.md\nindex 827a2fe5b..6c3aa1be5 100644\n--- a/docs/reference/cli.md\n+++ b/docs/reference/cli.md\n@@ -43,6 +43,16 @@ swebench report my-run                     # dataset taken from the run itself\n swebench report my-run -d multimodal -i grommet__grommet-6282\n ```\n \n+### `swebench publish RUN_ID`\n+\n+Upload a run's report (and predictions) to a Hugging Face bucket, and write a\n+`.eval_results/*.yaml` entry scored against it\n+([format](https://huggingface.co/docs/hub/eval-results)).\n+\n+```bash\n+swebench publish my-run -b myuser/swebench-runs --report gpt5.my-run.json -d verified --task-id swe_bench_%_resolved\n+```\n+\n ## Images\n \n Images are built from a task repo: each task carries its own Dockerfile, and its\ndiff --git a/pyproject.toml b/pyproject.toml\nindex bdd38286e..450683544 100644\n--- a/pyproject.toml\n+++ b/pyproject.toml\n@@ -27,6 +27,7 @@ dependencies = [\n     \"docker\",\n     \"ghapi<2\",  # 2.x is async: every call returns a coroutine\n     \"GitPython\",\n+    \"huggingface_hub>=1.20\",\n     \"modal\",\n     \"pre-commit\",\n     \"python-dotenv\",\ndiff --git a/swebench/cli/cli.py b/swebench/cli/cli.py\nindex 12836769f..10882e6ce 100644\n--- a/swebench/cli/cli.py\n+++ b/swebench/cli/cli.py\n@@ -18,6 +18,7 @@\n     swebench eval verified -p preds.jsonl --run-id gpt5 -j 16\n     swebench eval multimodal --gold -i carbon-design-system__carbon-10188\n     swebench report my-run -d verified\n+    swebench publish gpt5 -b myuser/swebench-runs -p preds.jsonl --model-id openai/gpt-5\n     swebench images build verified -j 8\n     swebench images check multilingual\n     swebench images clean --run-id my-run\n@@ -45,10 +46,15 @@ def main():\n \n \n from swebench.cli.dataset import dataset_app  # noqa: E402\n-from swebench.cli.evaluate import eval_command, report_command  # noqa: E402\n+from swebench.cli.evaluate import (  # noqa: E402\n+    eval_command,\n+    publish_command,\n+    report_command,\n+)\n from swebench.cli.images import images_app  # noqa: E402\n \n app.command(\"eval\", rich_help_panel=_PANEL_EVAL)(eval_command)\n app.command(\"report\", rich_help_panel=_PANEL_EVAL)(report_command)\n+app.command(\"publish\", rich_help_panel=_PANEL_EVAL)(publish_command)\n app.add_typer(images_app, name=\"images\", rich_help_panel=_PANEL_IMAGES)\n app.add_typer(dataset_app, name=\"dataset\", rich_help_panel=_PANEL_DATA)\ndiff --git a/swebench/cli/evaluate.py b/swebench/cli/evaluate.py\nindex 12aca3ecc..2b4db51b6 100644\n--- a/swebench/cli/evaluate.py\n+++ b/swebench/cli/evaluate.py\n@@ -1,5 +1,7 @@\n-\"\"\"`swebench eval` and `swebench report`.\"\"\"\n+\"\"\"`swebench eval`, `swebench report`, and `swebench publish`.\"\"\"\n \n+import json\n+from pathlib import Path\n from typing import Optional\n \n import typer\n@@ -134,3 +136,30 @@ def report_command(\n         # or the dataset's copy silently overrides them and the verdict changes\n         task_repo=recorded.get(\"task_repo\"),\n     )\n+\n+\n+def publish_command(\n+    run_id: str = typer.Argument(...),\n+    bucket: str = typer.Option(..., \"-b\", \"--bucket\"),\n+    report: str = typer.Option(..., \"--report\"),\n+    dataset: str = typer.Option(..., \"-d\", \"--dataset\"),\n+    task_id: str = typer.Option(..., \"--task-id\"),\n+    predictions: Optional[str] = typer.Option(None, \"-p\", \"--predictions\"),\n+    out: str = typer.Option(\".eval_results/result.yaml\", \"--out\"),\n+    dry_run: bool = typer.Option(False, \"--dry-run\"),\n+):\n+    from swebench.harness.publish_results import upload_run, write_eval_result\n+\n+    files = [report] + ([predictions] if predictions else [])\n+    plan = upload_run(bucket, run_id, files, dry_run=dry_run)\n+    typer.echo(json.dumps(plan, indent=2))\n+    if dry_run:\n+        return\n+\n+    report_data = json.loads(Path(report).read_text())\n+    value = 100 * report_data[\"resolved_instances\"] / report_data[\"total_instances\"]\n+    source_url = f\"https://huggingface.co/buckets/{bucket}/resolve/{plan['files'][0]}\"\n+    out_path = write_eval_result(\n+        resolve_dataset(dataset), task_id, value, source_url, out\n+    )\n+    typer.echo(f\"wrote {out_path}\")\ndiff --git a/swebench/harness/publish_results.py b/swebench/harness/publish_results.py\nnew file mode 100644\nindex 000000000..185b45f4f\n--- /dev/null\n+++ b/swebench/harness/publish_results.py\n@@ -0,0 +1,29 @@\n+from pathlib import Path\n+\n+import yaml\n+\n+\n+def upload_run(bucket_id, run_id, files, private=True, dry_run=False):\n+    files = [Path(f) for f in files]\n+    plan = {\"bucket\": bucket_id, \"files\": [f\"{run_id}/{f.name}\" for f in files]}\n+    if dry_run:\n+        return plan\n+\n+    from huggingface_hub import HfApi\n+\n+    api = HfApi()\n+    api.create_bucket(bucket_id, private=private, exist_ok=True)\n+    api.batch_bucket_files(bucket_id, add=list(zip(files, plan[\"files\"])))\n+    return plan\n+\n+\n+def write_eval_result(dataset, task_id, value, source_url, out_path):\n+    entry = {\n+        \"dataset\": {\"id\": dataset, \"task_id\": task_id},\n+        \"value\": value,\n+        \"source\": {\"url\": source_url},\n+    }\n+    out_path = Path(out_path)\n+    out_path.parent.mkdir(parents=True, exist_ok=True)\n+    out_path.write_text(yaml.safe_dump([entry], sort_keys=False))\n+    return out_path\ndiff --git a/tests/test_publish_results.py b/tests/test_publish_results.py\nnew file mode 100644\nindex 000000000..9ef721b4a\n--- /dev/null\n+++ b/tests/test_publish_results.py\n@@ -0,0 +1,30 @@\n+import yaml\n+\n+from swebench.harness.publish_results import upload_run, write_eval_result\n+\n+\n+def test_upload_run_dry_run(tmp_path):\n+    f = tmp_path / \"report.json\"\n+    f.write_text(\"{}\")\n+    plan = upload_run(\"me/bucket\", \"run-1\", [f], dry_run=True)\n+    assert plan == {\"bucket\": \"me/bucket\", \"files\": [\"run-1/report.json\"]}\n+\n+\n+def test_write_eval_result(tmp_path):\n+    out = write_eval_result(\n+        \"SWE-bench/SWE-bench_Verified\",\n+        \"swe_bench_%_resolved\",\n+        42.0,\n+        \"https://example.com/report.json\",\n+        tmp_path / \"result.yaml\",\n+    )\n+    assert yaml.safe_load(out.read_text()) == [\n+        {\n+            \"dataset\": {\n+                \"id\": \"SWE-bench/SWE-bench_Verified\",\n+                \"task_id\": \"swe_bench_%_resolved\",\n+            },\n+            \"value\": 42.0,\n+            \"source\": {\"url\": \"https://example.com/report.json\"},\n+        }\n+    ]\n",
  "github_state": "open",
  "github_created_at": "2026-08-19T14:37:46Z",
  "github_updated_at": "2026-08-19T15:13:26Z",
  "candidate_benchmark_names": [
    "swebench-verified",
    "swebench_multilingual"
  ],
  "terminal_status": "rejected",
  "audit_level": "L1",
  "decision_note": "This PR adds or changes optional tooling/metrics/publishing functionality and does not claim a current SWE-bench Verified or Multilingual benchmark defect.",
  "reviewed_at": "2026-08-22T00:07:09.734Z",
  "checked_urls": [
    "https://github.com/SWE-bench/SWE-bench/pull/642",
    "https://github.com/SWE-bench/SWE-bench/pull/642/files"
  ]
}
