{
  "schema_version": "v5.source-candidate.1",
  "source_url": "https://github.com/abundant-ai/swe-marathon/pull/282",
  "repo": "abundant-ai/swe-marathon",
  "source_type": "github_pr",
  "github_number": 282,
  "title": "Add mini-swe-agent and opencode Gemini 3.7 Flash to v1.1 logs audit",
  "body": "<!-- CURSOR_AGENT_PR_BODY_BEGIN -->\n## Summary\n\nRegisters two new v1.1 configurations in `scripts/read-swe-marathon-logs.py`:\n\n- **mini-swe-agent** + `fireworks/deepseek-v4-pro-0813` (Oddish experiment `2874a038`)\n- **opencode** + `gemini/gemini-3.7-flash` (Oddish experiment `fd8af5cd`)\n\n## S3 upload status\n\n### mini-swe-agent (DeepSeek V4 Pro)\n\nUpload to `s3://ralphbench-logs/v1.1/` is **in progress** but blocked on STS credential expiry (~1h lifetime). Last successful state before token expired:\n\n| Task | mini-swe trials in manifest |\n|------|----------------------------|\n| biofabric-rust-rewrite | 8/8 |\n| embedding-eval | 8/8 |\n| excel-clone | 2/8 (`1568`, `1569` committed; `1570` partial) |\n| Remaining 17 tasks | 0/8 |\n\n**~18/160** trials fully merged. All 160 trial artifacts are pulled locally at `/tmp/mini-swe-export`. Resume with fresh AWS creds using `/tmp/upload_oddish_trials_to_ralphbench.py` (skips trials already in manifest).\n\n### opencode + Gemini 3.7 Flash\n\n160 trials identified from experiment `fd8af5cd` (`google/gemini-3.7-flash`, high reasoning). Artifacts are being pulled locally to `/tmp/opencode-export`. S3 upload pending completion of DeepSeek upload + fresh credentials.\n\n## Test plan\n\n- [ ] Refresh AWS STS credentials\n- [ ] Finish mini-swe upload (resume from manifest)\n- [ ] Upload 160 opencode trials\n- [ ] `python scripts/read-swe-marathon-logs.py sync --prefix v1.1`\n- [ ] `python scripts/read-swe-marathon-logs.py audit --prefix v1.1 --check-canonical-matrix`\n\n<!-- CURSOR_AGENT_PR_BODY_END -->\n\n<div><a href=\"https://cursor.com/agents/bc-666a203f-51dd-4eee-86c4-33d2b5a78338?cursor_ref=pr_footer&cursor_cta=open_in_web\"><picture><source media=\"(prefers-color-scheme: dark)\" srcset=\"https://cursor.com/assets/images/open-in-web-dark.png\"><source media=\"(prefers-color-scheme: light)\" srcset=\"https://cursor.com/assets/images/open-in-web-light.png\"><img alt=\"Open in Web\" width=\"114\" height=\"28\" src=\"https://cursor.com/assets/images/open-in-web-dark.png\"></picture></a>&nbsp;<a href=\"https://cursor.com/background-agent?bcId=bc-666a203f-51dd-4eee-86c4-33d2b5a78338&cursor_ref=pr_footer&cursor_cta=open_in_cursor\"><picture><source media=\"(prefers-color-scheme: dark)\" srcset=\"https://cursor.com/assets/images/open-in-cursor-dark.png\"><source media=\"(prefers-color-scheme: light)\" srcset=\"https://cursor.com/assets/images/open-in-cursor-light.png\"><img alt=\"Open in Cursor\" width=\"131\" height=\"28\" src=\"https://cursor.com/assets/images/open-in-cursor-dark.png\"></picture></a>&nbsp;</div>\n\n",
  "comments": [],
  "linked_pr_diff": "diff --git a/scripts/read-swe-marathon-logs.py b/scripts/read-swe-marathon-logs.py\nindex efd492d86..c2c38fe77 100755\n--- a/scripts/read-swe-marathon-logs.py\n+++ b/scripts/read-swe-marathon-logs.py\n@@ -135,6 +135,8 @@\n     (\"claude-code\", \"zai/glm-5.3\", \"low\"),\n     (\"claude-code\", \"zai/glm-5.3\", \"high\"),\n     (\"claude-code\", \"zai/glm-5.3\", \"max\"),\n+    (\"mini-swe-agent\", \"fireworks/deepseek-v4-pro-0813\", None),\n+    (\"opencode\", \"gemini/gemini-3.7-flash\", None),\n     (\"claude-code\", \"zai/glm-5.3-flash\", \"max\"),\n     (\"kimi-claude-code\", \"moonshotai/kimi-k3\", None),\n     (\"kimi-code\", \"moonshotai/kimi-k3\", None),\n@@ -161,7 +163,9 @@\n     \"openai/gpt-5.6-luna\": \"openai/gpt-5.6-luna\",\n     # Gemini provider and shorthand IDs.\n     \"google/gemini-3.1-pro-preview\": \"gemini/gemini-3.1-pro-preview\",\n+    \"google/gemini-3.7-flash\": \"gemini/gemini-3.7-flash\",\n     \"gemini-3.1-pro-preview\": \"gemini/gemini-3.1-pro-preview\",\n+    \"gemini-3.7-flash\": \"gemini/gemini-3.7-flash\",\n     \"gemini/gemini-3.5-flash\": \"gemini/gemini-3.5-flash\",\n     \"gemini-3.5-flash\": \"gemini/gemini-3.5-flash\",\n     # Kimi K2.6 is the v1.0 OpenRouter model.\n@@ -190,6 +194,7 @@\n     \"glm-5.3\": \"zai/glm-5.3\",\n     \"glm-5.3[1m]\": \"zai/glm-5.3\",\n     \"zai/glm-5.3[1m]\": \"zai/glm-5.3\",\n+    \"deepseek-v4-pro-0813\": \"fireworks/deepseek-v4-pro-0813\",\n     # x-preview-l is Z.ai's submission identifier for GLM 5.3 Flash.\n     \"x-preview-l\": \"zai/glm-5.3-flash\",\n     \"glm-5.3-flash\": \"zai/glm-5.3-flash\",\n",
  "github_state": "closed",
  "github_created_at": "2026-08-26T02:06:32Z",
  "github_updated_at": "2026-08-27T00:59:05Z",
  "candidate_benchmark_names": [
    "swe-marathon"
  ],
  "terminal_status": "rejected",
  "audit_level": "L2",
  "decision_note": "L2 audit. PR #282 adds two model configurations to the SWE-Marathon log audit script and describes in-progress S3 trial upload status. This is leaderboard/log ingestion maintenance, not a benchmark defect artifact root cause.",
  "checked_urls": [
    "https://github.com/abundant-ai/swe-marathon/pull/282",
    "https://github.com/abundant-ai/swe-marathon/pull/282/files"
  ],
  "reviewed_at": "2026-08-28T01:07:14.304Z"
}
